{"entries":[{"critical":true,"diagnostic_code":null,"disposition":"preserved","redacted":true,"source_file":".workflow/architecture.yml","source_hash":"sha256:947a61a55a47f0b8f10245bfea98083267f30387f16d539e1026ef2620522a28","source_path":"/$key-sha256-69b75bf746a6ac7b","target_path":"/project/extensions/legacy.hekate/architecture/$key-sha256-69b75bf746a6ac7b"},{"critical":true,"diagnostic_code":null,"disposition":"preserved","redacted":true,"source_file":".workflow/architecture.yml","source_hash":"sha256:947a61a55a47f0b8f10245bfea98083267f30387f16d539e1026ef2620522a28","source_path":"/anti_patterns","target_path":"/project/extensions/legacy.hekate/architecture/anti_patterns"},{"critical":true,"diagnostic_code":null,"disposition":"transformed","redacted":true,"source_file":".workflow/architecture.yml","source_hash":"sha256:947a61a55a47f0b8f10245bfea98083267f30387f16d539e1026ef2620522a28","source_path":"/dependency_rules","target_path":"/project/architecture/constraints"},{"critical":true,"diagnostic_code":null,"disposition":"preserved","redacted":true,"source_file":".workflow/architecture.yml","source_hash":"sha256:947a61a55a47f0b8f10245bfea98083267f30387f16d539e1026ef2620522a28","source_path":"/layers","target_path":"/project/extensions/legacy.hekate/architecture/layers"},{"critical":true,"diagnostic_code":null,"disposition":"preserved","redacted":true,"source_file":".workflow/architecture.yml","source_hash":"sha256:947a61a55a47f0b8f10245bfea98083267f30387f16d539e1026ef2620522a28","source_path":"/modules","target_path":"/project/extensions/legacy.hekate/architecture/modules"},{"critical":true,"diagnostic_code":null,"disposition":"preserved","redacted":true,"source_file":".workflow/architecture.yml","source_hash":"sha256:947a61a55a47f0b8f10245bfea98083267f30387f16d539e1026ef2620522a28","source_path":"/patterns","target_path":"/project/extensions/legacy.hekate/architecture/patterns"},{"critical":true,"diagnostic_code":null,"disposition":"preserved","redacted":true,"source_file":".workflow/architecture.yml","source_hash":"sha256:947a61a55a47f0b8f10245bfea98083267f30387f16d539e1026ef2620522a28","source_path":"/style","target_path":"/project/extensions/legacy.hekate/architecture/style"},{"critical":true,"diagnostic_code":null,"disposition":"preserved","redacted":true,"source_file":".workflow/architecture.yml","source_hash":"sha256:947a61a55a47f0b8f10245bfea98083267f30387f16d539e1026ef2620522a28","source_path":"/style_notes","target_path":"/project/extensions/legacy.hekate/architecture/style_notes"},{"critical":true,"diagnostic_code":null,"disposition":"preserved","redacted":true,"source_file":".workflow/conventions.yml","source_hash":"sha256:0e925e40680affa380978df35ea355a182297f218bae0693731a9e99797b42bf","source_path":"/branches/$key-sha256-9372c470eeadd5ec","target_path":"/project/extensions/legacy.hekate/conventions/branches/$key-sha256-9372c470eeadd5ec"},{"critical":true,"diagnostic_code":null,"disposition":"preserved","redacted":true,"source_file":".workflow/conventions.yml","source_hash":"sha256:0e925e40680affa380978df35ea355a182297f218bae0693731a9e99797b42bf","source_path":"/branches/default","target_path":"/project/extensions/legacy.hekate/conventions/branches/default"},{"critical":true,"diagnostic_code":null,"disposition":"preserved","redacted":true,"source_file":".workflow/conventions.yml","source_hash":"sha256:0e925e40680affa380978df35ea355a182297f218bae0693731a9e99797b42bf","source_path":"/branches/flow","target_path":"/project/extensions/legacy.hekate/conventions/branches/flow"},{"critical":true,"diagnostic_code":null,"disposition":"preserved","redacted":true,"source_file":".workflow/conventions.yml","source_hash":"sha256:0e925e40680affa380978df35ea355a182297f218bae0693731a9e99797b42bf","source_path":"/branches/protected","target_path":"/project/extensions/legacy.hekate/conventions/branches/protected"},{"critical":true,"diagnostic_code":null,"disposition":"preserved","redacted":true,"source_file":".workflow/conventions.yml","source_hash":"sha256:0e925e40680affa380978df35ea355a182297f218bae0693731a9e99797b42bf","source_path":"/branches/style","target_path":"/project/extensions/legacy.hekate/conventions/branches/style"},{"critical":true,"diagnostic_code":null,"disposition":"preserved","redacted":true,"source_file":".workflow/conventions.yml","source_hash":"sha256:0e925e40680affa380978df35ea355a182297f218bae0693731a9e99797b42bf","source_path":"/code_style/$key-sha256-7f113a182c02411f","target_path":"/project/extensions/legacy.hekate/conventions/code_style/$key-sha256-7f113a182c02411f"},{"critical":true,"diagnostic_code":null,"disposition":"preserved","redacted":true,"source_file":".workflow/conventions.yml","source_hash":"sha256:0e925e40680affa380978df35ea355a182297f218bae0693731a9e99797b42bf","source_path":"/code_style/enforce_on_save","target_path":"/project/extensions/legacy.hekate/conventions/code_style/enforce_on_save"},{"critical":true,"diagnostic_code":null,"disposition":"preserved","redacted":true,"source_file":".workflow/conventions.yml","source_hash":"sha256:0e925e40680affa380978df35ea355a182297f218bae0693731a9e99797b42bf","source_path":"/code_style/formatter","target_path":"/project/extensions/legacy.hekate/conventions/code_style/formatter"},{"critical":true,"diagnostic_code":null,"disposition":"preserved","redacted":true,"source_file":".workflow/conventions.yml","source_hash":"sha256:0e925e40680affa380978df35ea355a182297f218bae0693731a9e99797b42bf","source_path":"/code_style/linter","target_path":"/project/extensions/legacy.hekate/conventions/code_style/linter"},{"critical":true,"diagnostic_code":null,"disposition":"preserved","redacted":true,"source_file":".workflow/conventions.yml","source_hash":"sha256:0e925e40680affa380978df35ea355a182297f218bae0693731a9e99797b42bf","source_path":"/code_style/max_line_length","target_path":"/project/extensions/legacy.hekate/conventions/code_style/max_line_length"},{"critical":true,"diagnostic_code":null,"disposition":"preserved","redacted":true,"source_file":".workflow/conventions.yml","source_hash":"sha256:0e925e40680affa380978df35ea355a182297f218bae0693731a9e99797b42bf","source_path":"/commits/$key-sha256-86b19047f6126e5b/0","target_path":"/project/extensions/legacy.hekate/conventions/commits/$key-sha256-86b19047f6126e5b/0"},{"critical":true,"diagnostic_code":null,"disposition":"preserved","redacted":true,"source_file":".workflow/conventions.yml","source_hash":"sha256:0e925e40680affa380978df35ea355a182297f218bae0693731a9e99797b42bf","source_path":"/commits/emoji_map","target_path":"/project/extensions/legacy.hekate/conventions/commits/emoji_map"},{"critical":true,"diagnostic_code":null,"disposition":"preserved","redacted":true,"source_file":".workflow/conventions.yml","source_hash":"sha256:0e925e40680affa380978df35ea355a182297f218bae0693731a9e99797b42bf","source_path":"/commits/language","target_path":"/project/extensions/legacy.hekate/conventions/commits/language"},{"critical":true,"diagnostic_code":null,"disposition":"preserved","redacted":true,"source_file":".workflow/conventions.yml","source_hash":"sha256:0e925e40680affa380978df35ea355a182297f218bae0693731a9e99797b42bf","source_path":"/commits/preset","target_path":"/project/extensions/legacy.hekate/conventions/commits/preset"},{"critical":true,"diagnostic_code":null,"disposition":"preserved","redacted":true,"source_file":".workflow/conventions.yml","source_hash":"sha256:0e925e40680affa380978df35ea355a182297f218bae0693731a9e99797b42bf","source_path":"/commits/require_body_for/0","target_path":"/project/extensions/legacy.hekate/conventions/commits/require_body_for/0"},{"critical":true,"diagnostic_code":null,"disposition":"preserved","redacted":true,"source_file":".workflow/conventions.yml","source_hash":"sha256:0e925e40680affa380978df35ea355a182297f218bae0693731a9e99797b42bf","source_path":"/commits/require_body_for/1","target_path":"/project/extensions/legacy.hekate/conventions/commits/require_body_for/1"},{"critical":true,"diagnostic_code":null,"disposition":"preserved","redacted":true,"source_file":".workflow/conventions.yml","source_hash":"sha256:0e925e40680affa380978df35ea355a182297f218bae0693731a9e99797b42bf","source_path":"/commits/require_body_for/2","target_path":"/project/extensions/legacy.hekate/conventions/commits/require_body_for/2"},{"critical":true,"diagnostic_code":null,"disposition":"preserved","redacted":true,"source_file":".workflow/conventions.yml","source_hash":"sha256:0e925e40680affa380978df35ea355a182297f218bae0693731a9e99797b42bf","source_path":"/commits/style","target_path":"/project/extensions/legacy.hekate/conventions/commits/style"},{"critical":true,"diagnostic_code":null,"disposition":"preserved","redacted":true,"source_file":".workflow/conventions.yml","source_hash":"sha256:0e925e40680affa380978df35ea355a182297f218bae0693731a9e99797b42bf","source_path":"/commits/subject_max_length","target_path":"/project/extensions/legacy.hekate/conventions/commits/subject_max_length"},{"critical":true,"diagnostic_code":null,"disposition":"preserved","redacted":true,"source_file":".workflow/conventions.yml","source_hash":"sha256:0e925e40680affa380978df35ea355a182297f218bae0693731a9e99797b42bf","source_path":"/documentation/api_docs","target_path":"/project/extensions/legacy.hekate/conventions/documentation/api_docs"},{"critical":true,"diagnostic_code":null,"disposition":"preserved","redacted":true,"source_file":".workflow/conventions.yml","source_hash":"sha256:0e925e40680affa380978df35ea355a182297f218bae0693731a9e99797b42bf","source_path":"/documentation/changelog","target_path":"/project/extensions/legacy.hekate/conventions/documentation/changelog"},{"critical":true,"diagnostic_code":null,"disposition":"preserved","redacted":true,"source_file":".workflow/conventions.yml","source_hash":"sha256:0e925e40680affa380978df35ea355a182297f218bae0693731a9e99797b42bf","source_path":"/documentation/readme_required","target_path":"/project/extensions/legacy.hekate/conventions/documentation/readme